<!--
        
Component  specification dtd.

-->

<!-- ********** Parameter Entities ********** -->

<!ENTITY % filename "(#PCDATA)">

<!-- A relative path specification. Used by rlink and slink elements'
     attributes. --> 
<!ENTITY % rpath "CDATA">

<!-- Link stuff -->
<!ENTITY % links "rlink | slink">
<!ENTITY % rlink.attr "path %rpath; #REQUIRED">

<!-- Text level stuff -->
<!ENTITY % phrase "term | keyword | keyboard | cite | acronym">
<!ENTITY % phrase.content "(#PCDATA)">
<!ENTITY % inline "%phrase; | %links;">
<!ENTITY % Inline "(#PCDATA | %inline;)*">
<!ENTITY % link.content "(#PCDATA | %phrase;)*">

<!-- Higher level stuff -->
<!ENTITY % lists "orderedlist | unorderedlist | desclist">
<!ENTITY % admonition "note | tip | warning">
<!ENTITY % block "p">
<!ENTITY % flow "%block; | %lists;">
<!ENTITY % BasicFlow "(%flow;)*">
<!ENTITY % DescFlow "(%flow; | developer | %admonition;)*">
<!ENTITY % DevFlow "(%flow; | %admonition;)*">
<!ENTITY % AdmonFlow "(%flow;)*">

<!-- ********** Elements ********** -->

<!-- A couple of reusable elements  -->
<!ELEMENT datatype (#PCDATA)>
<!ELEMENT componentname (#PCDATA)>
<!ELEMENT devicename (#PCDATA)>

<!-- Top level -->
<!ELEMENT component (overview, implementation?, io, gui?, testing)>
<!ATTLIST component 
        name CDATA #REQUIRED
        category CDATA #REQUIRED>

<!--  Overview of component's purpose  -->
<!ELEMENT overview (authors, summary, description, examplesr)>

<!-- Brief (1 or 2 sentence) summary. -->
<!ELEMENT summary (#PCDATA)>

<!--  Author(s) -->
<!ELEMENT authors (author+)>

<!--  1 author  -->
<!ELEMENT author (#PCDATA)>

<!-- Name of sr file which demonstrates use of this component  -->
<!ELEMENT examplesr %filename;>

<!-- All the extra code files needed to build this component -->
<!ELEMENT implementation (ccfile | cfile | ffile)+>

<!-- The name of a single .cc file -->
<!ELEMENT ccfile (#PCDATA)>

<!-- The name of a single .c file -->
<!ELEMENT cfile (#PCDATA)>

<!-- The name of a single .f file -->
<!ELEMENT ffile (#PCDATA)>

<!-- Component's inputs and outputs  -->
<!ELEMENT io (inputs, outputs)>

<!-- Component's inputs.  Inputs may come from a file, port, or device.  -->
<!ELEMENT inputs (file | port | device)+>
<!ATTLIST inputs lastportdynamic (yes | no) "no">

<!-- Component's outputs.  Outputs may be sent to a file, port, or device. -->
<!ELEMENT outputs (file | port | device)+>

<!-- Describe content of file (i.e. temperature data) and the datatype
     contained in the file. --> 
<!ELEMENT file (description, datatype)>

<!-- Describe data on port (i.e. temperature data) and the datatype being
     transmitted.  --> 
<!ELEMENT port (name, description, datatype, componentname+)>

<!-- The user-defined name for this port -->
<!ELEMENT name (#PCDATA)>

<!-- Describe data on device -->
<!ELEMENT device (devicename, description)>

<!-- GUI description (words and pictures) -->
<!ELEMENT gui (description, parameter+, img)>

<!-- Description of 1 gui parameter. -->
<!ELEMENT parameter (widget, label, description)>

<!-- Name of gui item (tcl/tk) widget -->
<!ELEMENT widget (#PCDATA)>

<!-- Gui item label -->
<!ELEMENT label (#PCDATA)>

<!--  Name of an image file -->
<!ELEMENT img %filename;>

<!-- Specify testing plan(s) -->
<!ELEMENT testing (plan+)>

<!-- Specify 1 testing plan.  -->
<!ELEMENT plan (description, step+)>

<!-- Specify 1 testing step -->
<!ELEMENT  step %DescFlow;>

<!-- Mini-documentation environment -->
<!ELEMENT description %DescFlow;>

<!-- Description information targeted at developers -->
<!ELEMENT developer %DevFlow;>

<!-- Calls attention to some piece of information. -->
<!ELEMENT note %AdmonFlow;>

<!-- A friendly word of advice. --> 
<!ELEMENT tip %AdmonFlow;>

<!-- A warning of some sort. -->
<!ELEMENT warning %AdmonFlow;>

<!-- Paragraph. -->
<!ELEMENT p %Inline;>

<!-- Relative link (relative to location of spec.xml file). -->
<!ELEMENT rlink %link.content;>
<!ATTLIST rlink %rlink.attr;>

<!-- Sci web site relative link -->
<!ELEMENT slink %link.content;>
<!ATTLIST slink %rlink.attr;>

<!-- "Phrases" - Content-based style tags. Inline stuff. -->
<!ELEMENT term %phrase.content;>        <!-- Introduce a new term -->
<!ELEMENT keyword %phrase.content;>     <!-- Introduce a keyword -->
<!ELEMENT keyboard %phrase.content;>    <!-- Show something typed at a keyboard -->
<!ELEMENT cite %phrase.content;>        <!-- Citation -->
<!ELEMENT acronym %phrase.content;>     <!-- An acronym -->             

<!-- Ordered list, unordered list, and description list. -->
<!ELEMENT orderedlist (listitem)+>
<!ELEMENT unorderedlist (listitem)+>
<!ELEMENT listitem %BasicFlow;>
<!ELEMENT desclist (desclistitem)+>
<!ELEMENT desclistitem (desclistterm, desclistdef)>
<!ELEMENT desclistterm (#PCDATA)>
<!ELEMENT desclistdef %BasicFlow;>

