<?xml version="1.0" encoding="UTF-8" ?>
<!DOCTYPE component SYSTEM "../../../doc/ReferenceGuide/component.dtd">

<component name="PathWriter" category="Writers">
  <overview>
    <authors>
      <author>Dave Weinstein</author>
    </authors>
    <summary>Summary not available yet.</summary>
    <description>
      <p>Version Date: 1994</p><p>Version: 1.0</p>
    </description>
  </overview>
  <io>
  </io>
  <testing>
  </testing>
</component>
