<?xml version="1.0" encoding="UTF-8" ?>
<!DOCTYPE component SYSTEM "../../../../Dataflow/XML/component.dtd">
<?xml-stylesheet href="../../../../../doc/package-component.xsl" type="text/xsl"?>
<?cocoon-process type="xslt"?>

<component name="DipoleMatrixSourceRHSQuadratic" category="Forward">
  <overview>
    <authors>
    </authors>
  </overview>
  <implementation>
  </implementation>
  <io>
    <inputs lastportdynamic="no">
      <port>
        <name>QuadTetVolField</name>
        <datatype>SCIRun::Field</datatype>
      </port>
      <port>
        <name>DipoleSource</name>
        <datatype>SCIRun::Field</datatype>
      </port>
      <port>
        <name>Input RHS</name>
        <datatype>SCIRun::Matrix</datatype>
      </port>
    </inputs>
    <outputs>
      <port>
        <name>OutPut RHS</name>
        <datatype>SCIRun::Matrix</datatype>
      </port>
    </outputs>
  </io>
  <gui>
  </gui>
  <testing>
  </testing>
</component>

