<?xml version="1.0" encoding="UTF-8" ?>
<!DOCTYPE component SYSTEM "../../../doc/ReferenceGuide/component.dtd">

<component name="NodeHedgehog" category="Visualization">
  <overview>
    <authors>
      <author>Steven G. Parker</author>
      <author>James Bigler</author>
    </authors>
    <summary>Summary not available yet.</summary>
    <description>
      <p>Version Date: June 2000</p><p>Version: 2.0</p>
    </description>
  </overview>
  <io>
  </io>
  <testing>
  </testing>
</component>
