<?xml version="1.0" encoding="UTF-8" ?>
<!DOCTYPE component SYSTEM "../../../../../doc/Utilities/XML/component.dtd">
<?xml-stylesheet href="../../../../../doc/Utilities/XML/package-component.xsl" type="text/xsl"?>
<?cocoon-process type="xslt"?>

<component name="MDSPlusFieldReader" category="DataIO">
  <overview>
    <authors>
      <author>ARSanderson</author>
    </authors>
  </overview>
  <implementation>
  </implementation>
  <io>
    <inputs lastportdynamic="no">
    </inputs>
    <outputs>
      <port>
	<name>Output Pressure Field</name>
	<datatype>SCIRun::Field</datatype>
      </port>
      <port>
	<name>Output B Field</name>
	<datatype>SCIRun::Field</datatype>
      </port>
      <port>
	<name>Output V Field</name>
	<datatype>SCIRun::Field</datatype>
      </port>
      <port>
	<name>Output J Field</name>
	<datatype>SCIRun::Field</datatype>
      </port>
    </outputs>
  </io>
  <gui>
    <parameter>
      <widget>Label</widget>
      <label>Autogenerated GUI explanation</label>
    </parameter>
  </gui>
  <testing>
  </testing>
</component>

