<?xml version="1.0" encoding="UTF-8" ?>
<!DOCTYPE component SYSTEM "../../../../../doc/component.dtd">
<?xml-stylesheet href="../../../../../doc/package-component.xsl" type="text/xsl"?>
<?cocoon-process type="xslt"?>

<component name="TetVol2QuadraticTetVol" category="Quadratic">
  <overview>
    <authors>
    </authors>
  </overview>
  <implementation>
  </implementation>
  <io>
    <inputs lastportdynamic="no">
      <port>
        <name>InputTetField</name>
        <datatype>SCIRun::Field</datatype>
      </port>
    </inputs>
    <outputs>
      <port>
        <name>OutputQuadraticTet</name>
        <datatype>SCIRun::Field</datatype>
      </port>
    </outputs>
  </io>
  <gui>
  </gui>
  <testing>
  </testing>
</component>

