<?xml version="1.0" encoding="UTF-8" ?>
<!DOCTYPE component SYSTEM "../../../../../doc/Utilities/XML/component.dtd">
<?xml-stylesheet href="../../../../../doc/Utilities/XML/package-component.xsl" type="text/xsl"?>
<?cocoon-process type="xslt"?>

<component name="SurfaceRecon" category="Surface">
  <overview>
    <authors>
    </authors>
  </overview>
  <implementation>
  </implementation>
  <io>
    <inputs lastportdynamic="no">
      <port>
        <name>point_cloud</name>
        <datatype>SCIRun::Field</datatype>
      </port>
    </inputs>
    <outputs>
      <port>
        <name>surface_mesh</name>
        <datatype>SCIRun::Field</datatype>
      </port>
    </outputs>
  </io>
  <gui>
    <parameter>
      <widget>Label</widget>
      <label>Autogenerated GUI explanation</label>
    </parameter>
  </gui>
  <testing>
  </testing>
</component>

