<?xml version="1.0" encoding="UTF-8" ?>
<!DOCTYPE component SYSTEM "component.dtd">

<!--
   For more information, please see: http://software.sci.utah.edu

   The MIT License

   Copyright (c) 2004 Scientific Computing and Imaging Institute,
   University of Utah.

   License for the specific language governing rights and limitations under
   Permission is hereby granted, free of charge, to any person obtaining a
   copy of this software and associated documentation files (the "Software"),
   to deal in the Software without restriction, including without limitation
   the rights to use, copy, modify, merge, publish, distribute, sublicense,
   and/or sell copies of the Software, and to permit persons to whom the
   Software is furnished to do so, subject to the following conditions:

   The above copyright notice and this permission notice shall be included
   in all copies or substantial portions of the Software.

   THE SOFTWARE IS PROVIDED "AS IS", WITHOUT WARRANTY OF ANY KIND, EXPRESS
   OR IMPLIED, INCLUDING BUT NOT LIMITED TO THE WARRANTIES OF MERCHANTABILITY,
   FITNESS FOR A PARTICULAR PURPOSE AND NONINFRINGEMENT. IN NO EVENT SHALL
   THE AUTHORS OR COPYRIGHT HOLDERS BE LIABLE FOR ANY CLAIM, DAMAGES OR OTHER
   LIABILITY, WHETHER IN AN ACTION OF CONTRACT, TORT OR OTHERWISE, ARISING
   FROM, OUT OF OR IN CONNECTION WITH THE SOFTWARE OR THE USE OR OTHER
   DEALINGS IN THE SOFTWARE.
-->

<component name="BundleGetPath" category="Bundle">
  <overview>
    <authors>
      <author>Jeroen Stinstra</author>
    </authors>
    <summary>
      This module retrieves a 'path' object from a bundle. 
    </summary>
    <description>
      <p>This module retrieves a 'path' object from a bundle by
specifying the name of that object. The module has three output ports
that each can be programmed to retrieve a specific 'path' object. </p>
      
      <p>The module's first bundle output port just generates a copy
of the input bundle.</p>
    </description>
  </overview>
  <io>
    <inputs lastportdynamic="no">
      <port>
        <name>bundle</name>
        <datatype>SCIRun::Bundle</datatype>
      </port>
    </inputs>
    <outputs>
      <port>
        <name>bundle</name>
        <datatype>SCIRun::Bundle</datatype>
      </port>
      <port>
        <name>path1</name>
        <datatype>SCIRun::Path</datatype>
      </port>
      <port>
        <name>path2</name>
        <datatype>SCIRun::Path</datatype>
      </port>
      <port>
        <name>path3</name>
        <datatype>SCIRun::Path</datatype>
      </port>
    </outputs>
  </io>
</component>

